{
	"schema": "urn:graphrefly-stack:schema:golden-suite:v1",
	"task": {
		"schema": "urn:graphrefly-stack:schema:task:v1",
		"taskId": "rotate-refresh-token-on-use",
		"text": "Rotate the refresh token after every successful /session/refresh request; reject replay of the previous token; preserve the token-family ID; return the replacement token; and do not change password-reset behavior."
	},
	"stack": {
		"schema": "urn:graphrefly-stack:schema:git-stack:v1",
		"linearity": "linear",
		"base": { "algorithm": "sha1", "value": "0000000000000000000000000000000000000001" },
		"head": { "algorithm": "sha1", "value": "3333333333333333333333333333333333333333" },
		"commits": [
			{
				"oid": { "algorithm": "sha1", "value": "0000000000000000000000000000000000000001" },
				"parent": null,
				"role": "base",
				"workUnitId": null
			},
			{
				"oid": { "algorithm": "sha1", "value": "1111111111111111111111111111111111111111" },
				"parent": {
					"algorithm": "sha1",
					"value": "0000000000000000000000000000000000000001"
				},
				"role": "work-unit",
				"workUnitId": "U1"
			},
			{
				"oid": { "algorithm": "sha1", "value": "2222222222222222222222222222222222222222" },
				"parent": {
					"algorithm": "sha1",
					"value": "1111111111111111111111111111111111111111"
				},
				"role": "work-unit",
				"workUnitId": "U2"
			},
			{
				"oid": { "algorithm": "sha1", "value": "3333333333333333333333333333333333333333" },
				"parent": {
					"algorithm": "sha1",
					"value": "2222222222222222222222222222222222222222"
				},
				"role": "work-unit",
				"workUnitId": "U3"
			}
		]
	},
	"provider": {
		"schema": "urn:graphrefly-stack:schema:blueprint-provider-capabilities:v1",
		"providerId": "graphrefly",
		"providerVersion": "0.1.1",
		"blueprintVersion": "graphrefly.blueprint.v1",
		"capabilities": {
			"commitSnapshot": true,
			"canonicalTopologyBytes": true,
			"nodeMetadata": true,
			"subgraphs": true,
			"diagnostics": true,
			"structuralDelta": true,
			"mergeParentSelection": false,
			"claimImpact": false
		}
	},
	"manifest": {
		"schema": "urn:graphrefly-stack:schema:bundle-manifest:v1",
		"runId": "fixture-refresh-token-rotation-v1",
		"recordedAt": "2026-07-16T00:00:00Z",
		"sourceCommit": { "algorithm": "sha1", "value": "1111111111111111111111111111111111111111" },
		"canonicalInputDigest": {
			"algorithm": "sha256",
			"value": "aaaaaaaaaaaaaaaaaaaaaaaaaaaaaaaaaaaaaaaaaaaaaaaaaaaaaaaaaaaaaaaa"
		},
		"schemaVersion": "v1",
		"promptVersion": "fixture.v1",
		"model": { "source": "fixture", "id": "fixture", "reasoningEffort": "none" },
		"provider": {
			"schema": "urn:graphrefly-stack:schema:blueprint-provider-capabilities:v1",
			"providerId": "graphrefly",
			"providerVersion": "0.1.1",
			"blueprintVersion": "graphrefly.blueprint.v1",
			"capabilities": {
				"commitSnapshot": true,
				"canonicalTopologyBytes": true,
				"nodeMetadata": true,
				"subgraphs": true,
				"diagnostics": true,
				"structuralDelta": true,
				"mergeParentSelection": false,
				"claimImpact": false
			}
		},
		"graphreflyVersion": "0.1.1",
		"policyRevision": "session-writes.v2",
		"artifacts": [
			{
				"path": "task.json",
				"hash": {
					"algorithm": "sha256",
					"value": "bbbbbbbbbbbbbbbbbbbbbbbbbbbbbbbbbbbbbbbbbbbbbbbbbbbbbbbbbbbbbbbb"
				}
			}
		]
	},
	"changePlan": {
		"schema": "urn:graphrefly-stack:schema:change-plan:v1",
		"planId": "plan.refresh-token-rotation.v1",
		"taskDigest": {
			"algorithm": "sha256",
			"value": "bbbbbbbbbbbbbbbbbbbbbbbbbbbbbbbbbbbbbbbbbbbbbbbbbbbbbbbbbbbbbbbb"
		},
		"baseCommit": { "algorithm": "sha1", "value": "1111111111111111111111111111111111111111" },
		"baseBlueprintHash": {
			"algorithm": "sha256",
			"value": "1111111111111111111111111111111111111111111111111111111111111111"
		},
		"policyRevision": "session-writes.v1",
		"source": "fixture",
		"workUnits": [
			{
				"id": "U1",
				"title": "Define refresh rotation contracts",
				"intent": "Define token-family and replay-rejection contracts.",
				"dependencies": [],
				"allowedSourceScopes": ["src/session/contracts.ts", "tests/session/contracts.test.ts"],
				"blueprintClaims": [],
				"requiredChecks": ["contracts"]
			},
			{
				"id": "U2",
				"title": "Implement the GraphReFly refresh rotation flow",
				"intent": "Rotate and persist the replacement refresh token.",
				"dependencies": ["U1"],
				"allowedSourceScopes": [
					"src/session/flows/refresh-flow.ts",
					"tests/session/refresh-flow.test.ts"
				],
				"blueprintClaims": [
					{
						"id": "session-write-path",
						"statement": "The online session mutation may persist directly under session-writes.v1."
					}
				],
				"requiredChecks": ["refresh-runtime"]
			},
			{
				"id": "U3",
				"title": "Expose the refresh HTTP adapter",
				"intent": "Return the replacement token and reject replay.",
				"dependencies": ["U2"],
				"allowedSourceScopes": ["src/http/refresh-route.ts", "tests/http/refresh-route.test.ts"],
				"blueprintClaims": [
					{ "id": "refresh-runtime", "statement": "The adapter depends on an accepted U2 runtime." }
				],
				"requiredChecks": ["refresh-api"]
			}
		]
	},
	"snapshots": [
		{
			"schema": "urn:graphrefly-stack:schema:blueprint-snapshot:v1",
			"commit": { "algorithm": "sha1", "value": "3333333333333333333333333333333333333333" },
			"semanticParent": {
				"algorithm": "sha1",
				"value": "2222222222222222222222222222222222222222"
			},
			"provider": {
				"schema": "urn:graphrefly-stack:schema:blueprint-provider-capabilities:v1",
				"providerId": "graphrefly",
				"providerVersion": "0.1.1",
				"blueprintVersion": "graphrefly.blueprint.v1",
				"capabilities": {
					"commitSnapshot": true,
					"canonicalTopologyBytes": true,
					"nodeMetadata": true,
					"subgraphs": true,
					"diagnostics": true,
					"structuralDelta": true,
					"mergeParentSelection": false,
					"claimImpact": false
				}
			},
			"blueprint": {
				"version": "graphrefly.blueprint.v1",
				"provenance": { "fixture": "refresh-token-rotation-v1", "ref": "S3" },
				"topology": {
					"name": "session",
					"nodes": [
						{ "id": "password-reset.intent", "factory": "state", "deps": [] },
						{
							"id": "session.persist.password-reset",
							"factory": "effect",
							"deps": ["password-reset.intent"],
							"meta": { "capability": "session-mutation", "mode": "online" }
						},
						{ "id": "refresh.request", "factory": "state", "deps": [] },
						{ "id": "refresh.validate", "factory": "derived", "deps": ["refresh.request"] },
						{ "id": "refresh.rotate", "factory": "derived", "deps": ["refresh.validate"] },
						{
							"id": "session.persist.refresh",
							"factory": "effect",
							"deps": ["refresh.rotate"],
							"meta": { "capability": "session-mutation", "mode": "online" }
						}
					],
					"edges": [
						{ "from": "password-reset.intent", "to": "session.persist.password-reset" },
						{ "from": "refresh.request", "to": "refresh.validate" },
						{ "from": "refresh.validate", "to": "refresh.rotate" },
						{ "from": "refresh.rotate", "to": "session.persist.refresh" }
					]
				},
				"diagnostics": { "ok": true, "issues": [] },
				"hash": {
					"kind": "topology",
					"algorithm": "sha256",
					"input": "strictCanonicalTopologyBytes",
					"value": "1111111111111111111111111111111111111111111111111111111111111111"
				}
			},
			"topologyHash": {
				"algorithm": "sha256",
				"value": "1111111111111111111111111111111111111111111111111111111111111111"
			},
			"policyRevision": "session-writes.v1"
		},
		{
			"schema": "urn:graphrefly-stack:schema:blueprint-snapshot:v1",
			"commit": { "algorithm": "sha1", "value": "6666666666666666666666666666666666666666" },
			"semanticParent": {
				"algorithm": "sha1",
				"value": "5555555555555555555555555555555555555555"
			},
			"provider": {
				"schema": "urn:graphrefly-stack:schema:blueprint-provider-capabilities:v1",
				"providerId": "graphrefly",
				"providerVersion": "0.1.1",
				"blueprintVersion": "graphrefly.blueprint.v1",
				"capabilities": {
					"commitSnapshot": true,
					"canonicalTopologyBytes": true,
					"nodeMetadata": true,
					"subgraphs": true,
					"diagnostics": true,
					"structuralDelta": true,
					"mergeParentSelection": false,
					"claimImpact": false
				}
			},
			"blueprint": {
				"version": "graphrefly.blueprint.v1",
				"topology": {
					"name": "session",
					"nodes": [
						{ "id": "password-reset.intent", "factory": "state", "deps": [] },
						{
							"id": "session.mutation-broker.password-reset",
							"factory": "sessionMutationBroker",
							"deps": ["password-reset.intent"],
							"meta": { "capability": "session-mutation-broker" }
						},
						{
							"id": "session.persist.password-reset",
							"factory": "effect",
							"deps": ["session.mutation-broker.password-reset"],
							"meta": { "capability": "session-mutation", "mode": "online" }
						},
						{ "id": "refresh.request", "factory": "state", "deps": [] },
						{ "id": "refresh.validate", "factory": "derived", "deps": ["refresh.request"] },
						{ "id": "refresh.rotate", "factory": "derived", "deps": ["refresh.validate"] },
						{
							"id": "session.persist.refresh",
							"factory": "effect",
							"deps": ["refresh.rotate"],
							"meta": { "capability": "session-mutation", "mode": "online" }
						}
					],
					"edges": [
						{ "from": "password-reset.intent", "to": "session.mutation-broker.password-reset" },
						{
							"from": "session.mutation-broker.password-reset",
							"to": "session.persist.password-reset"
						},
						{ "from": "refresh.request", "to": "refresh.validate" },
						{ "from": "refresh.validate", "to": "refresh.rotate" },
						{ "from": "refresh.rotate", "to": "session.persist.refresh" }
					]
				},
				"diagnostics": { "ok": true, "issues": [] },
				"hash": {
					"kind": "topology",
					"algorithm": "sha256",
					"input": "strictCanonicalTopologyBytes",